{
  "$schema": "../../schemas/capability-profile.schema.json",
  "schemaVersion": 1,
  "id": "omp-interactive",
  "target": {
    "runtime": "omp",
    "surface": "cli-interactive",
    "runtimeVersion": "18.2.6",
    "platform": "macos-arm64",
    "configurationFingerprint": "project-agents-skill-copy+interactive-tui+cursor-default+probe-scoped-tools+no-extensions+no-rules",
    "permissionProfile": "interactive-user-input+read-only-probe",
    "installedProviders": []
  },
  "capabilities": {
    "agents.cancel": { "status": "unknown", "provider": null, "evidence": null },
    "agents.custom_roles": { "status": "unknown", "provider": null, "evidence": null },
    "agents.follow_up": { "status": "unknown", "provider": null, "evidence": null },
    "agents.model_override": { "status": "unknown", "provider": null, "evidence": null },
    "agents.read_result": { "status": "unknown", "provider": null, "evidence": null },
    "agents.read_transcript": { "status": "unknown", "provider": null, "evidence": null },
    "agents.reasoning_override": { "status": "unknown", "provider": null, "evidence": null },
    "agents.spawn": { "status": "unknown", "provider": null, "evidence": null },
    "agents.spawn_parallel": { "status": "unknown", "provider": null, "evidence": null },
    "agents.wait": { "status": "unknown", "provider": null, "evidence": null },
    "commands.run": { "status": "unknown", "provider": null, "evidence": null },
    "coordination.peer_messages": { "status": "unknown", "provider": null, "evidence": null },
    "interaction.fixed_choice": { "status": "native", "provider": "ask interactive TUI", "evidence": "evals/evidence/omp-18.2.6/check-interaction.json" },
    "interaction.free_text": { "status": "native", "provider": "ask interactive TUI custom input", "evidence": "evals/evidence/omp-18.2.6/check-interaction.json" },
    "resources.relative_paths": { "status": "native", "provider": "skill://", "evidence": "evals/evidence/omp-18.2.6/check-interaction.json" },
    "scripts.execute": { "status": "unknown", "provider": null, "evidence": null },
    "skills.discover": { "status": "native", "provider": ".agents/skills with explicit --skills inventory", "evidence": "evals/evidence/omp-18.2.6/check-interaction.json" },
    "skills.invoke.explicit": { "status": "native", "provider": "skill://", "evidence": "evals/evidence/omp-18.2.6/check-interaction.json" },
    "workspace.inspect": { "status": "unknown", "provider": null, "evidence": null },
    "workspace.isolate": { "status": "unknown", "provider": null, "evidence": null },
    "workspace.write": { "status": "unknown", "provider": null, "evidence": null }
  }
}
